{
  "schema": "https://absolutejs.github.io/agents/schemas/package-registry-index/v1.json",
  "generatedAt": "2026-07-31T19:07:01.841Z",
  "count": 24,
  "packages": [
    {
      "name": "@absolutejs/auth",
      "version": "0.55.0",
      "category": "identity",
      "description": "Human, service, and agent authentication with native agent registration and claim flows.",
      "npm": "https://www.npmjs.com/package/@absolutejs/auth",
      "repository": "https://github.com/absolutejs/auth",
      "standards": [
        "OAuth 2.0",
        "OIDC",
        "RFC 8693",
        "WebAuthn",
        "SCIM"
      ]
    },
    {
      "name": "@absolutejs/agent",
      "version": "0.1.0",
      "category": "orchestration",
      "description": "Provider-agnostic agent action contracts, policy gates, approvals, idempotency, and audit hooks.",
      "npm": "https://www.npmjs.com/package/@absolutejs/agent",
      "repository": "https://github.com/absolutejs/agent"
    },
    {
      "name": "@absolutejs/agents-mcp",
      "version": "0.2.0",
      "category": "discovery",
      "description": "Official MCP server for finding verified agents and production agent-first AbsoluteJS packages.",
      "npm": "https://www.npmjs.com/package/@absolutejs/agents-mcp",
      "repository": "https://github.com/absolutejs/agents-mcp",
      "standards": [
        "MCP 2025-11-25"
      ]
    },
    {
      "name": "@absolutejs/agent-discovery",
      "version": "0.2.0",
      "category": "discovery",
      "description": "Signed, provider-neutral agent discovery documents, registries, search, presentation, and hardened remote resolution.",
      "npm": "https://www.npmjs.com/package/@absolutejs/agent-discovery",
      "repository": "https://github.com/absolutejs/agent-modules/tree/main/discovery"
    },
    {
      "name": "@absolutejs/a2a",
      "version": "0.2.0",
      "category": "protocol",
      "description": "A2A 1.0 agent cards, messaging, tasks, streaming, and authorization-aware handlers.",
      "npm": "https://www.npmjs.com/package/@absolutejs/a2a",
      "repository": "https://github.com/absolutejs/a2a",
      "standards": [
        "A2A 1.0"
      ]
    },
    {
      "name": "@absolutejs/mcp",
      "version": "0.10.1",
      "category": "protocol",
      "description": "Production MCP servers and clients with current protocol support and secure agent-facing primitives.",
      "npm": "https://www.npmjs.com/package/@absolutejs/mcp",
      "repository": "https://github.com/absolutejs/mcp",
      "standards": [
        "MCP 2025-11-25"
      ]
    },
    {
      "name": "@absolutejs/arazzo",
      "version": "0.1.0",
      "category": "workflow",
      "description": "Arazzo 1.1 parsing, validation, dependency planning, runtime expressions, authorization, and execution.",
      "npm": "https://www.npmjs.com/package/@absolutejs/arazzo",
      "repository": "https://github.com/absolutejs/arazzo",
      "standards": [
        "Arazzo 1.1"
      ]
    },
    {
      "name": "@absolutejs/webmcp",
      "version": "0.1.0",
      "category": "protocol",
      "description": "Secure WebMCP tool registration, policy, approvals, metadata validation, and abort-aware browser execution.",
      "npm": "https://www.npmjs.com/package/@absolutejs/webmcp",
      "repository": "https://github.com/absolutejs/webmcp",
      "standards": [
        "WebMCP CG Draft 2026-07-10"
      ]
    },
    {
      "name": "@absolutejs/agency",
      "version": "0.5.0",
      "category": "authorization",
      "description": "Durable, attenuated agent delegation with cascading revocation, resource/effect/spend bounds, and PostgreSQL storage.",
      "npm": "https://www.npmjs.com/package/@absolutejs/agency",
      "repository": "https://github.com/absolutejs/agency"
    },
    {
      "name": "@absolutejs/agent-conformance",
      "version": "0.4.0",
      "category": "testing",
      "description": "Cross-protocol conformance suites for MCP, A2A, Arazzo, WebMCP, auth, and safe action semantics.",
      "npm": "https://www.npmjs.com/package/@absolutejs/agent-conformance",
      "repository": "https://github.com/absolutejs/agent-modules/tree/main/conformance"
    },
    {
      "name": "@absolutejs/agent-control",
      "version": "0.3.0",
      "category": "operations",
      "description": "Secure operator console and bound plan-then-execute playground for inspecting and approving agent actions.",
      "npm": "https://www.npmjs.com/package/@absolutejs/agent-control",
      "repository": "https://github.com/absolutejs/agent-modules/tree/main/control"
    },
    {
      "name": "@absolutejs/agent-reputation",
      "version": "0.1.1",
      "category": "trust",
      "description": "Scoped, expiring, revocable agent reputation evidence using W3C Verifiable Credentials and JOSE/COSE adapters.",
      "npm": "https://www.npmjs.com/package/@absolutejs/agent-reputation",
      "repository": "https://github.com/absolutejs/agent-modules/tree/main/reputation",
      "standards": [
        "W3C Verifiable Credentials 2.0"
      ]
    },
    {
      "name": "@absolutejs/agent-runtime",
      "version": "0.1.0",
      "category": "runtime",
      "description": "Runtime lifecycle and execution foundations for production agents.",
      "npm": "https://www.npmjs.com/package/@absolutejs/agent-runtime",
      "repository": "https://github.com/absolutejs/agent-modules/tree/main/runtime"
    },
    {
      "name": "@absolutejs/agent-sandbox",
      "version": "0.1.0",
      "category": "security",
      "description": "Isolation and resource controls for untrusted agent workloads.",
      "npm": "https://www.npmjs.com/package/@absolutejs/agent-sandbox",
      "repository": "https://github.com/absolutejs/agent-modules/tree/main/sandbox"
    },
    {
      "name": "@absolutejs/agent-trust",
      "version": "0.1.0",
      "category": "trust",
      "description": "Trust decisions and evidence plumbing for agent interactions.",
      "npm": "https://www.npmjs.com/package/@absolutejs/agent-trust",
      "repository": "https://github.com/absolutejs/agent-modules/tree/main/trust"
    },
    {
      "name": "@absolutejs/agent-memory",
      "version": "0.1.0",
      "category": "memory",
      "description": "Policy-aware durable agent memory.",
      "npm": "https://www.npmjs.com/package/@absolutejs/agent-memory",
      "repository": "https://github.com/absolutejs/agent-modules/tree/main/memory"
    },
    {
      "name": "@absolutejs/agent-inbox",
      "version": "0.1.0",
      "category": "communication",
      "description": "Durable agent-to-human and agent-to-agent inbox workflows.",
      "npm": "https://www.npmjs.com/package/@absolutejs/agent-inbox",
      "repository": "https://github.com/absolutejs/agent-modules/tree/main/inbox"
    },
    {
      "name": "@absolutejs/wallet",
      "version": "0.3.0",
      "category": "payments",
      "description": "Limited-funds wallets and payment controls suitable for bounded agent spending.",
      "npm": "https://www.npmjs.com/package/@absolutejs/wallet",
      "repository": "https://github.com/absolutejs/wallet"
    },
    {
      "name": "@absolutejs/manifest",
      "version": "0.3.0",
      "category": "discoverability",
      "description": "Machine-readable package manifests that teach agents how to use AbsoluteJS packages.",
      "npm": "https://www.npmjs.com/package/@absolutejs/manifest",
      "repository": "https://github.com/absolutejs/manifest"
    },
    {
      "name": "@absolutejs/policy",
      "version": "0.2.0",
      "category": "authorization",
      "description": "Composable policy decisions for agent and application actions.",
      "npm": "https://www.npmjs.com/package/@absolutejs/policy",
      "repository": "https://github.com/absolutejs/policy"
    },
    {
      "name": "@absolutejs/secrets",
      "version": "0.7.0",
      "category": "security",
      "description": "Secret access and lifecycle controls for applications and agents.",
      "npm": "https://www.npmjs.com/package/@absolutejs/secrets",
      "repository": "https://github.com/absolutejs/secrets"
    },
    {
      "name": "@absolutejs/telemetry",
      "version": "0.2.0",
      "category": "operations",
      "description": "Telemetry primitives for observable agent operations.",
      "npm": "https://www.npmjs.com/package/@absolutejs/telemetry",
      "repository": "https://github.com/absolutejs/telemetry"
    },
    {
      "name": "@absolutejs/audit",
      "version": "0.1.0",
      "category": "operations",
      "description": "Tamper-evident action audit records.",
      "npm": "https://www.npmjs.com/package/@absolutejs/audit",
      "repository": "https://github.com/absolutejs/audit"
    },
    {
      "name": "@absolutejs/execution",
      "version": "0.2.0",
      "category": "runtime",
      "description": "Bounded execution primitives for applications and agents.",
      "npm": "https://www.npmjs.com/package/@absolutejs/execution",
      "repository": "https://github.com/absolutejs/execution"
    }
  ]
}
